{
  "id": "bdmp-sportordnung-2026-teile-b-c-d",
  "title": "BDMP-Handbuch Sportordnung, Register 6 bis 10, Teile A bis F (Sportordnung v. 24.02.2026)",
  "publisher": "BDMP e.V.",
  "edition": "Sportordnung v. 24.02.2026, Stand 04.12.2025 (approved by notice of the Bundesverwaltungsamt of 24.02.2026)",
  "url": "https://www.bva.bund.de/SharedDocs/Downloads/DE/Buerger/Ausweis-Dokumente-Recht/Waffenrecht/Schiesssport/bdmp_sportordnung.pdf?__blob=publicationFile&v=11",
  "retrieved": "2026-10-21",
  "sha256": "73f1e00fea47fcecaf9dcc81eb29b7af1a512e896b5e63ab26ae33799733cbff"
}
