{
  "id": "bdmp-sportordnung-2026-register-6",
  "title": "BDMP-Handbuch Sportordnung, Register 6, Teil A Sportordnung (genehmigt mit Bescheid des Bundesverwaltungsamts vom 24.02.2026 und 17.03.2026)",
  "publisher": "BDMP e.V.",
  "edition": "Sportordnung v. 24.02.2026, Teil A genehmigt mit Bescheid des Bundesverwaltungsamts vom 24.02.2026 und 17.03.2026",
  "url": "https://www.bdmp.de/fileadmin/user_upload/bdmp/ueber_uns/handbuch/2025/Register_6.pdf",
  "retrieved": "2026-10-21",
  "sha256": "438d82367a00ca4ec71f5d6a829b9a01eebddb12630070acce3b3e94b2b130b7"
}
