{
  "id": "vdrbw-schiesssportordnung-2023",
  "title": "Schießsportordnung des VdRBw e.V.",
  "publisher": "Verband der Reservisten der Deutschen Bundeswehr e.V.",
  "edition": "bewilligt am 18. Dezember 2023, gezeichnet am 19. Dezember 2023, ersetzt die Fassung vom 26. März 2019",
  "url": "https://www.bva.bund.de/SharedDocs/Downloads/DE/Buerger/Ausweis-Dokumente-Recht/Waffenrecht/Schiesssport/vdrbw_sportordnung.pdf?__blob=publicationFile&v=2",
  "retrieved": "2026-10-21",
  "sha256": "964652065cbfe0a4f1e6492ed9d046fe4f16d8cdcfd9f2d6c6ca2a140c44e227"
}
